{
  "apiVersion": "iip.platform/v1alpha1",
  "kind": "CredentialBrokerCompatibilityReport",
  "metadata": {
    "id": "cbr_11111111111111111111111111111111",
    "generatedAt": "2026-08-17T18:00:00Z",
    "sourceRevision": "0123456789abcdef0123456789abcdef01234567",
    "sourceDirty": false
  },
  "spec": {
    "status": "compatible",
    "environment": {
      "platform": "linux/arm64",
      "containerRuntime": "docker",
      "containerRuntimeVersion": "28.3.3",
      "pythonVersion": "3.12.11",
      "applicationVersion": "0.52.0"
    },
    "profile": {
      "name": "local-tls-workload-identity-v1",
      "brokerProtocol": "iip.broker/v1alpha1",
      "workloadTokenProfile": "signed-jwt-fixture",
      "leaseScheme": "bearer",
      "maxLeaseSeconds": 120
    },
    "checks": [
      {"id": "ca-verified-tls", "status": "passed"},
      {"id": "untrusted-ca-denial", "status": "passed"},
      {"id": "workload-jwt-authentication", "status": "passed"},
      {"id": "audience-denial", "status": "passed"},
      {"id": "subject-denial", "status": "passed"},
      {"id": "exact-scope-lease", "status": "passed"},
      {"id": "cross-tenant-denial", "status": "passed"},
      {"id": "scope-escalation-denial", "status": "passed"},
      {"id": "rotation-without-restart", "status": "passed"},
      {"id": "revocation", "status": "passed"},
      {"id": "audit-completeness", "status": "passed"},
      {"id": "broker-outage-fail-closed", "status": "passed"},
      {"id": "broker-recovery", "status": "passed"},
      {"id": "secret-redaction", "status": "passed"}
    ],
    "summary": {
      "totalChecks": 14,
      "passedChecks": 14,
      "failedChecks": 0,
      "overallStatus": "compatible"
    }
  }
}
